{
  "request": {
    "task_id": "legal-panel-escalate-001",
    "task_kind": "demand_drafting",
    "objective": "Emitir una recomendacion preliminar sobre daño moral con una tesis cuya aplicacion es dudosa.",
    "query": "¿Puede citarse la tesis 2006737 como apoyo central en este asunto de daño moral?",
    "jurisdiction": "federal",
    "matter_profile": "civil_damage",
    "query_date": "2026-03-30",
    "complexity": "high",
    "consequence_level": "critical",
    "requires_jurisprudence": true,
    "writes_for_user": true
  },
  "draft_bundle": {
    "request_id": "req-pass-juris-001",
    "response_type": "recommendation",
    "jurisdiction": "federal",
    "query_date": "2026-03-30",
    "response_text": "La linea argumental puede apoyarse en la tesis con registro digital 2006737 y en el articulo 1916 del Codigo Civil Federal, pero conviene delimitar con precision el alcance del criterio.",
    "citations": [
      {
        "citation_id": "cit-juris-2006737",
        "doc_type": "jurisprudence",
        "doc_id": "mx-sjf-tesis-2006737",
        "registry_id": "2006737",
        "title": "DAÑO MORAL. SU CLASIFICACIÓN EN CUANTO AL CARÁCTER DEL INTERÉS AFECTADO.",
        "locator": "registro digital 2006737",
        "jurisdiction": "federal",
        "source_url": "https://www.scjn.gob.mx/sites/default/files/pagina_transparencia/documento/2016-11/Criterios_PJF_Proteccion_datos_2a_Ed_Feb_2016.pdf",
        "quote": "En nuestro ordenamiento jurídico se plantea una distinción en el tratamiento de la responsabilidad por daño al patrimonio moral, dependiendo de su carácter.",
        "quote_sha256": "6415549d34a75a4ed438d7d1a8207223ddf5badd3e683ef5d05796f30f5a41f0"
      },
      {
        "citation_id": "cit-ccf-1916-j",
        "doc_type": "legislation",
        "doc_id": "mx-federal-ccf",
        "title": "Codigo Civil Federal",
        "locator": "articulo 1916",
        "jurisdiction": "federal",
        "source_url": "https://www.diputados.gob.mx/LeyesBiblio/ref/ccf.htm",
        "official_publication": "DOF",
        "quote": "Cuando un hecho u omision ilicitos produzcan un dano moral, el responsable del mismo tendra la obligacion de repararlo mediante una indemnizacion en dinero",
        "quote_sha256": "53c4add5494708a088a2606c4bff7a12553e5d4e128fc3871ff57ea3dcf4b2f5"
      }
    ],
    "claims": [
      {
        "claim_id": "clm-juris-1",
        "text": "La tesis 2006737 puede servir como apoyo interpretativo para clasificar especies de daño moral.",
        "kind": "jurisprudence",
        "citation_ids": [
          "cit-juris-2006737"
        ]
      }
    ]
  },
  "initial_vote_round": [
    {
      "persona": "litigante_actor",
      "decision": "approve",
      "confidence": 0.89,
      "justification": "La tesis puede fortalecer la narrativa."
    },
    {
      "persona": "abogado_contraparte",
      "decision": "conditional",
      "confidence": 0.77,
      "justification": "La contraparte cuestionaria la extrapolacion del criterio."
    },
    {
      "persona": "juzgador_revisor",
      "decision": "conditional",
      "confidence": 0.74,
      "justification": "La tesis parece util, pero su alcance debe acotarse."
    },
    {
      "persona": "revisor_probatorio",
      "decision": "approve",
      "confidence": 0.82,
      "justification": "La base factica no muestra vacio inmediato."
    },
    {
      "persona": "revisor_jurisprudencial",
      "decision": "conditional",
      "confidence": 0.84,
      "justification": "La tesis existe, pero su aplicacion al caso exige delimitacion estricta."
    }
  ],
  "final_vote_round": [
    {
      "persona": "litigante_actor",
      "decision": "approve",
      "confidence": 0.90,
      "justification": "La recomendacion sigue siendo defendible."
    },
    {
      "persona": "abogado_contraparte",
      "decision": "conditional",
      "confidence": 0.79,
      "justification": "Persisten flancos de ataque si se formula como regla fuerte."
    },
    {
      "persona": "juzgador_revisor",
      "decision": "conditional",
      "confidence": 0.76,
      "justification": "La redaccion debe mantener la tesis como apoyo interpretativo, no como automatismo."
    },
    {
      "persona": "revisor_probatorio",
      "decision": "approve",
      "confidence": 0.83,
      "justification": "No hay hueco probatorio nuevo."
    },
    {
      "persona": "revisor_jurisprudencial",
      "decision": "conditional",
      "confidence": 0.88,
      "justification": "La aplicacion de la tesis sigue siendo delicada y exige supervision humana."
    }
  ]
}
